text,Score
citibank indonesia does not have a twitter handle we can escalate your concerns however we will ne,neutral
tell firstbank to refund my money i m a student every dime goes as long,negative
bankers are rich bankers are boring,neutral
dear this dude is one of my followers if you give him a job i promise you i will reactivate my account,neutral
oya come let me deliver you i get the antidote,neutral
pls i mistakenly sent k to a customer instead of k and am unable to reach the person kindly,neutral
adekunle gold makes yoruba seem so foreign i m gonna go with him,neutral
that s the annoying thing about these banks working days weeks,negative
kindly check your dm i sent a message since yesterday,neutral
don t let anything get you down today tooblessedtobestressed fridaymotivation tgif,neutral
we are so sorry to hear this please send the details of your complaint via dm to acc,neutral
happening now fiworldwide graduating session going on now pitching to,neutral
k to get a laptop for my programming language tutorials gtbank,neutral
i m having the same problem i ve sent you message on,negative
hello bernard we re sorry for just reaching out to you please send a dm to accessbank help providin,neutral
who knows the handle of this tobi abiodun guy that did the rap ad for that they often show on channel,neutral
l folashade femi lawal head card amp messaging first bank of nigeria limited with the best bank in epayment awar,neutral
your dm is closed account number date amount naira,neutral
good morning i tried contacting my account officer this morning to purchase treasury bill only to be,neutral
kindly help till gives me a trial i believe i can do better as i ve had a fair knowledge of the,neutral
dear good morning how was your night how is operations going i will love to work for you people should,neutral
is more than ready to receive and cater to your every financial needs sir wearefidelity,neutral
so far so good is n,neutral
we lost him folks,neutral
thanks for the loyalty citibank years as a cardholder day late once in all that time and they won t waive,neutral
uba magic banking was the life of the party at ubaafricaday stay tuned massive giveaway coming on watch this,neutral
did that thank you,positive 
join us this saturday to support breast cancer awareness in the month of october free breast screening available brea,neutral
what s with you guys sending money and it never going through it s becoming too embarrassing,negative
enterprise amp banks are adopting blockchain,neutral
your customer service in poland sucks you guys invented absurd fees call me in polish but you know that,neutral
to celebrate this week s head of house in bbnaija the hms will organise a coronation ceremony themed after the tiv culture a,neutral
very useless bank customers services poor online banking useless hidden charges keep coming in you re th,negative
am yet to get a reversal on a transaction i made on the that wasn t successful,negative
guy wizkid no worth rich mill,neutral
someone transferred to my account yesterday by pm and i m yet to see the money in my account and i want to u,negative
growing up being able to interprete the time was a struggle now that we can all interprete the time correctly we shou,neutral
it is so painful that a local transfer done on the till date has not reflected in the account,negative
tickets for kody and the kids are fast selling buy now before it is sold out gt gt may th lt lt access fee k,neutral
payment done i m paying off your credit card debts for you follow and dm me if you have bills and debts t,neutral
gtbank keeps sending me messages when i don t have an account with them,neutral
i ve contacted and they said i transferred twice how come na how can i do two transfer within a space,neutral
i m still looking forward to it oh,neutral
hi we d love to sort this out as we re sorry about the discomfort felt please dm our,neutral
africasglobalbank thekidinme tope alabi ni o she uses lots of pure yoruba words in her songs,neutral
i thought it was a good idea to call into citibank customer service to let them know that charging customer money f,neutral
not interested if you advertise on any murdoch s media including fox ny post and conser,neutral
it s ubaat giveaway amp we re giving out ubaprepaidcards pre loaded with cash gift bags airtime amp data to win pick a,neutral
egbon please bless me too gtbank,neutral
i still dey wait oh my bank,negative
our planet is dying and citibank still be like you owe us,negative
what s our own,neutral
sent it please check your dm,neutral
i have been trying to withdraw for the past couple of days and up till present i m still getting a servic,neutral
it is no longer noble to relegate our native attires to the background for sundays or introductions thank you,neutral
update about the water of katampe project the contractor is on site drilling is happening and in a few days this communi,neutral
try out the new firstmobile app from first bank,neutral
not suspicious jeffreyepstein s private wealth banker who brokered and signed off on untold multiple millions of dollars,neutral
next station kids are loving the attention closertopro,neutral
my bank transfers are incomplete it s been almost hrs already,negative
this so called bank irritates me so much i am going to close my account even the i might not be am,negative
since venezuela couldn t pay interest on its gold for usd swap loan they lent gold to deutsche bank for usd they ve de,neutral
yes it is,neutral
i m a final year student of pharmacy yesterday morning by got a string of alerts from almost all the mone,neutral
why is your mobile app down since today even ussd is down too,neutral
santaleo kindly reward she s been a very good sister and supporter,neutral
we are live at stylebyzenith don t miss out on the masterclasses sales exhibitions and music performances from nige,neutral
gtbank s staff generated n million each in profit for the bank zenith s staff generated n million,neutral
problems to solve are in abundance businesses need to collaborate to solve them abubakar suleiman md,neutral
check your dm,neutral
pls my barcode is not displaying again how will i get a pass for rave ravetrf on d th,neutral
we humbly ask for your help to save mrs sodiya who was diagnosed of end stage kidney disease no amount is too small a,neutral
here are some of the exhibitors that will be at the ubamarketplace registration is till on click on,neutral
i dm u guys few days ago that i want to make an enquiry should know when someone send you a dm it,neutral
we are happy to let you know that won maiden innovation challenge this new collaboration is a giant,neutral
pls i tried withdrawing from my account on an atm i got debited but it didn t dispense cash,negative
it s more days to the biggest trad fair in nigeria even wizkid is not missing it for anything it s free to attend,neutral
i have sent you a dm few hours back pls reply so i m sure i ve sent it to the right handler,neutral
hi so sorry about this kindly provide more details via dm on our accessbank hel,neutral
thanks hopefully they will change the current app layout,positive 
hi please send a dm to our accessbank help twitter handle for assistance,neutral
vist an ecobank branch to solve this face to face brov,neutral
you don t want me to use access bank app again and you don t want to help with my mobile app,neutral
the annoying part i didnt still get it done i dont know when started to demand to see the,negative
spiriitual is also my choice at this point,neutral
it means when you dial your banks ussd code to recharge you are going to be charged per sessi,neutral
yes for sure,neutral
dear this dude is one of my followers if you give him a job i promise you i will reactivate my account,neutral
this coming friday how do you want to flex well got you covered this summer ps uti is the celebrity guest not,neutral
jared kushner received from a pressured country a b bailout for the kushner s build,neutral
answer this question with a word without saying yes yeah yep or yup do you want to win n million when we hit,neutral
i discover that pike is missing from my account which i have message first bank but nothin,neutral
special thanks to our fcmbflexxtern partners digital,neutral
i tried making a transaction last night and i was debited and it has not been reversed back kindly,negative
please check your dm,neutral
any registered bank or stockbroker,neutral
i was wrongly debited of an amount of money via a transaction with ikeja electric with no payment made i,negative
you nack am right,positive 
pro football player saquon barkley prides himself on being a role model for athletes watch as he and some young players disc,neutral
no wonder i loved this commercial when i hea,positive 
there will be free expert cancer consultation and screening for all at the uon chancellor s court or graduation grounds tomorrow,neutral
hi tweeps a while back i used the gtworld app and as a ui designer it was doing me one kain so i decided to,negative
i was with one girl s phone yesterday when gtbank sent her i m at home start coming she obviously saved someone s,neutral
pos transaction shows declined only for me to be debited kindly help me trace tried logging t,negative
my problem is i made transfer of recharging my mtn line of n i was debited and the money was no,negative
pick your answer please,neutral
leave a comment if your organization would like to get involved digifypro digifyng d,neutral
please i made a payment of euros with my access mastercard yesterday but today i discovered i,neutral
we re in love with places we ve never visited like the bahamas let us know the places you ll love to use your ca,neutral
help us loud this issue tht useless bank for africa is so annoying,negative
but bankers on here would have you believe these charges are chicken change and the banks don t make any profit off them,neutral
star boyyyy,neutral
twitter i really need your help i need k to win this nk giveaway from mazi ibe i really need,neutral
show reports gtbank fashion weekend day viviers,neutral
gtbank bro do something tillidie,negative
please credit this account adeneye badejoko m gtbank,neutral
you don t have to know him personally before you help save him helpomastransplant,neutral
l bought airtime from my account using for my glo line for my etisalat the money was ded,neutral
hey people if you applied or know anyone that applied and successfully got a loan under gtbank s fashion industry credit holla at me,neutral
val king as we all know it raining season our heart reach out to the homeless peopl,neutral
dear the person with name jones uwakwe acc is involved in fraud activity i will appreciate it if its,negative
kindly check your dm,neutral
hello i need you to configure my mastercard debit card so that i can do online transactions my acct,neutral
trump s main banks citibank chase manhattan bankers trust and manufacturers hanover have agreed,neutral
lol you no well aswear,negative
it s time the look into the massive corruption in the banking sector staff who have put in many year,negative
hi thank you for contacting us kindly send a dm to our twitter help handle accessbank he,neutral
request for a new one at your bank to qualify for the promo just make sure u start making use of the card the lo,neutral
as at april when our audit was done we had done transactions worth over nbillion our banks are,neutral
epstein strikes again another one kills themself one of his bankers,neutral
but you are yet to solve my query,negative
when zenith bank s minimum account balance was and gtbank went for account opening balance their target au,neutral
good evening i made payment for an online training via my mobile app wish i was also debited since on tu,neutral
hello our sincerest apologies for this situation kindly tell us the atm or busin,neutral
no nothing of sort,neutral
security center identity theft protection citibank,neutral
hi i made a ussd transfer from my account to another account and i ve been debited since yest,neutral
try out the new stanbic app from stanbic ibtc,neutral
justiceforadetutu justicefortutu are been quiet about the murder of one of their akure staff miss adetutu,negative
kindly help complete federal university of agriculture abeokuta funaab masjid it needs m t t,neutral
why is d only financial institution hugely supporting sports especially basketball in nigeria leaves me thinkin,neutral
i nominate switch summer camp,neutral
in other news welcome to gtbank somewhere in lekki earlier today oceaneconomy,neutral
kindly credit my acct with the k unit i purchased on your mobile app i need that unit for a very impor,neutral
the image brings no memories since you guys don t reply your customers dm,negative
this bank gives me too much of issues,negative
you spoke we listened find the missing value and stand a chance to win countdown to nigeria s foremos,neutral
drag dem for here take my word for it dem no go return ur money if u no shook leg for their trouza,negative
don t miss out on the mega giveaways happening on our page we are giving out free ubacards pre loaded with cash movie tick,neutral
still waiting for your response,negative
and when you call customer care it just doesn t work,negative
made use of the app to pay my utilities for the very time i ve been debited amp yet my,neutral
i already did said i have multiple accounts i m in camp and will need to submit this soonest pls,neutral
pls i didn t authorize the payment of to netflix from my a c,neutral
follow us now for useful banking tips,neutral
shop without limit pay for visa air tickets hotels amp more with your naira or dollar mastercard fcmbsummer ht,neutral
what happened to responding in my dm were i reached out as opposed to putting my business here biko,neutral
here s how to nail the s look effortlessly,neutral
please reply me dm,neutral
honestly i heard sacked upto employees on con,neutral
our dysfunctional vatican,neutral
don t be a victim be wary of unusually friendly faces at atm points don t accept transfers from strangers asking you to,neutral
okay we will,neutral
as usual linked their creative to finance the core of their business the dice showed dates tha,neutral
extra expenses are simply unnecessary when you can do without them pay zero charges on all your transactions today,neutral
abdulwaris ahmad,neutral
are you thinking what am thinking,neutral
gtbank doesn t reduct my money oh they are the best i don t have the app tho,positive 
failed biller payment bt money debited pls help to rectify,neutral
hey the citibank ceo literally dictated the cabinet for you,neutral
you borrow money but they always beg you to pay back you borrow credit amp then you change your sim these negatively a,neutral
justiceforadetutu justicefortutu are been quiet about the murder of one of their akure staff miss adetutu,negative
davido s shoes wiz s networth,neutral
dear is it right that should transfer money into another person s accoun,neutral
i m yet to get a reply i transferred money to someone and the person said he hasn t seen it i wa,negative
wouldn t you want yourself some super sweet iphone s currently available for gb is n gb is n,neutral
check dm,neutral
everyone can now enjoy premium banking services with zenith bank all you have to do is dial from your mobile devic,neutral
the children were well fed all thanks to and the unicef initiative no kid was left behind,neutral
guys i need your help my project water of katampe just got a lifeline we need k retweets for the great people at,neutral
mrtx upgrade to buy and pt citibank pt to from sun trust gapping up,neutral
i m paying tax and it s not my duty to clean up waste,neutral
it is more than weeks now and you guys are yet to effect my reversal meanwhile says reversa,negative
dear a fraudster who goes by the name oluwatayo akanbi has just duped me of n,negative
garden egg and ose oji no thinking about it,neutral
open ur dm,neutral
pls my account was debited twice and i ve not received a reversal,negative
pls i need my branch sort code diamond alaba branch thanks,neutral
uk the economy is about billion smaller than if the country had voted to stay in the eu and a no deal brexit could,neutral
boss that bank is really fucked up now,negative
your naira can buy sanitary pads for a secondary school girl who can t afford one we will be reaching out to,neutral
no time,neutral
this sounds interesting seems like it s time to dump some banks,negative
bro na elect elect you do o how come about the bank knowledge nawa o,neutral
do follow for your ankara tote bags they are available and pocket friendly dm to place your orde,neutral
they ve not been that bad and i haven t experienced a worse service just give me insights,neutral
hello access please i need your help connecting my account with my bvn good evening,neutral
how can i increase my transfer limits,neutral
for free,neutral
i refuse to choose,neutral
i don t know what is wrong with your website have been trying to get my pin for mobile app transa,neutral
qanda what is gtbank nuban number join foskaayforum for answers live thanks,neutral
does the app work without atm,neutral
fraudsters deepfake ceo s voice to trick manager into transferring btw citibank uses voice biometrics to match pe,negative
account details airhunmwunde monalisa gtbank please guys even if it s k pleaseeeee,neutral
thank you for your response will do,positive 
uba brand ambassador wizkid starboy put on an electrifying show last night at the kololo airstrip uba was well represent,neutral
what is wrong now i cannot withdraw make transfers or even buy airtime i just embarrassed my self at spar,negative
please poop people of god i m still expecting the credit alert from my fbn to my fcmb since yesterday i won,negative
pls can you credit back my account after you debited me for a failed atm transaction this happen,negative
guys i need your help my project water of katampe just got a lifeline we need k retweets for the great people at,neutral
its gonna be awesome guys and our queen of highlights is gonna be there come through our lagos mercenaries mercyxmapi,neutral
nollywood is already waiting for him buh he needs to stay for the icons we need him,neutral
do you know agriculture is a trillion dollar economy so why are you not investing in it tbh you re are doing yourself o,neutral
twitter please this one is on us peter is losing his sights by the day he needs n to temporarily sustain his sight,neutral
just letting you know that there won t be any rest till i get my money back tomorrow is a working da,negative
tomorrow we walk for a common goal one aim and one heart in alliance with we are taking a heart wa,neutral
o ye nigerian rogue bank what other secret bank accounts and secret banking transactions have you,negative
also no idea what is in the letter i need an explanation asap as it may be a something that could expos,neutral
try my own it will go first bank,neutral
did you miss this with just ngn you can now invest in companies like total nigeria dangote cement nestle gtbank,neutral
how come your name is bright but you are not bright,negative
correct also large stock holder in twitter and citibank wikileaks exposes his and citibank s role in,neutral
i have dm my complaint to you for over a week and my money is not yet reversed,negative
mention and on twitter using the below i nominate medicaid cancer foundation,neutral
going by experience i am really worried that beyond heritage there are much more p,neutral
not user friendly,negative
may allah forgive her shortcomings and grants her jannah my condolence,neutral
dear sirs,neutral
kindly attend to my dm,neutral
good to know many thanks,positive 
i need a bank better than any suggestions,negative
oh dear we are very sorry to hear this please let us know the location of these atms,neutral
pls read ur dm,neutral
fresh like new uk used apple iphone is currently available price gb is n gb is n,neutral
i need ur assistance pls,neutral
best bank,positive 
a strong network is definitely needed for seamless usage of the app however there should not be a,neutral
in the current political climate it is fashionable to talk about breaking oligopolies of fb amazon google apple etc alm,neutral
the food you love the drink you love the fashion you love and all you love in one location at the ubamarketplace totall,neutral
great,positive 
hello my mobile app is saying no account found this is my account number,neutral
my own simpler and smarter bank what is wrong with the network i made a transfer since yesterday to a,positive 
hi you asked me to remind you of this tweet,neutral
please dm us a screenshot of the feedback to accessbank help to be assisted,neutral
estola got my reward already ubabirthdays,neutral
a certain individual had only one job,neutral
good afternoon the money was sent from my gtb to diamond acct on friday and it has not been delivered,neutral
i have dm you details of the transaction no response indicating your prompt activity in my complaint what and whe,neutral
hello we apologize for this experience please be informed that you can re,neutral
jeffrey epstein s private wealth banker who brokered and signed off on untold multiple millions of dollars in controver,neutral
check your dm my complains have been made,neutral
igwilo valkiing,neutral
i need your help in confirming the details of this transaction cbn neft revenue e collection inec,neutral
this is the response i got from you and this are the questions i need a,neutral
i logged in a complain last week that i did a pos transaction and i was debited and the trans,negative
which time are u coming to maiduguri,neutral
happeningnow africa s largest entrepreneurial fair ubamarketplace shop eat play amp network with industry experts polic,neutral
you davido and dubai what could be better spend days in dubai with davido in the dubai summer tour vacation organized,neutral
i nominate they are the one who deserve this,neutral
worst bank in nigeria,negative
do everything with leo do everything with united bank for africa,positive 
brothers and sisters please fatima abdullahi has been cancer patient for one year now and right now she also has brai,neutral
i dream of a nigeria where corruption is killed and transparency becomes a friend of all a land where everyone will put,neutral
please my sister just had all the money in her access bank account cleared ngn she received alerts from from wal,neutral
i prefer a week at the kenyan safari tour travel weekendvibes vacation,neutral
good day i will like a double debit of n airtime made on my account after first attempt displayed an err,neutral
omg that s my voice,neutral
the future of fashion will be sketched by a new generation of african designers will you be one here is an opportunity to tu,neutral
how is the weekend going you can deposit cash from today s sales using our envelope deposit smes entrepreneur,neutral
went to gtbank fashion weekend wearing my brand made this outfit in less than hours,neutral
lemme rack my brain,neutral
dear this dude is one of my followers if you give him a job i promise you i will reactivate my account,neutral
i think you people bit more than you can chew,negative
how can my bank be requesting failed transaction receipt from road side pos after acknow,negative
i dunno why they created this handle if it doesn t work baba w,negative
pristine clean direct uk used apple macbook air amp pro are currently available ranges from,neutral
good morning is there any reasonable explanation as to why all transfers to my account aren t,neutral
if it s crispy then i shot it,neutral
click on this link to submit your nominations enablingsuccessngo ngo nonprofit christmasca,neutral
i used my card to buy fuel at a filling station this morning i just noticed i am debited twic,negative
gtbank akai mfreke mfon god s blessings and thank you will be in order,neutral
account details fatima abdullah gtbank no amount is little,neutral
travel the world and make astonishing recollections this mid year with your card you approach for booking and,neutral
before i take your case to cbn reply my dms,negative
wrote you ppl about a payment made online through map ikejaelectric online payment money was debited acc,neutral
help enkay create more timeless experiences in the bbnaija pepper dem house voting closes at wat so hurry,neutral
dear this dude is one of my followers if you give him a job i promise you i will reactivate my account,neutral
good evening senior citezen mrs firstbank please i m still waiting for my phcn electricity recharge,neutral
na piggy hole sure pass this days tell me carpenter to m,neutral
in partnership with launched st class material a program which will recognise excepti,neutral
i transferred money yesterday to access bank and first bank have being debited but the receiver haven t been credited,negative
success doesn t just find you you have to go out and get it saturdayvibes,neutral
i m a final year student of pharmacy yesterday morning by got a string of alerts from almost all the mone,neutral
quicktip ever attempted a transaction from the atm pos mobile banking app and you get debited but the transaction was unsucce,negative
hello good morning today will make it working days i removed the sallah holidays from th,neutral
hello j thank you for your interest in a career with citibank i would like to escalate this to our h,neutral
i never had issues with diamond bank for years there was no reason to go complain about their services,positive 
my account has been debited wrongly of today i was suppose to be debited of and my accoun,negative
hi lanre ensure all dm should be sent to this handle accessbank help oam,neutral
