text,Score
thanks so much for this platform my aunt has been frustrated by for a funds transfer relate,negative
hi we apologize for the inconvenience kindly reach out to us on our help page accessbank help,neutral
hong kong is literally the worst bank can t even receive of the otp sms messages,negative
your mobile app has not revert to the revised charges on electronic transfer this morning i atte,neutral
to cuppy this tune and party with for free register now at she is definitely ready t,neutral
please check your dm and do the needful,neutral
so i saw a tweet about this and that read various comments with myopic assertions i can boldly sa,neutral
they ll be very safe under a morrison government world s largest banks sued for rigging australian dollar and oth,neutral
good morning pls where are we on our issue,neutral
you re addressing the wrong person,neutral
and refused to collect a mutilated note and it has being in my office drawe,neutral
i tried to withdraw and it debited me but didn t dispense cash neither was there a reversal,negative
hi please be informed that this is a debit for a card transaction performed from th september till dat,neutral
she s not on twitter she has being going to the bank since then nothing good has come out of it,negative
okay thank you i understand better now at least they should also send mails to notify on monthly charge,positive 
don t just set goals this week make detailed plans on how to achieve them and see your goals come true cantstopwontstop,neutral
remember the collapse of british steel has nothing to do with brexit also nothing to do with brexit sony dyson fl,neutral
always the same in uba akwa branch tellers but only one open long queues for a minutes operation the worst,negative
this guy came to our mobile banking agent office to make a transaction he was to transfer to our account to collec,neutral
lol please this is all pr should i talk about the random naira debits that have been happeni,negative
experience seamless banking today with zenith bank bankonthego bankbetter,neutral
twitter fam please help me get my favorite bank to sponsor my xmas tradefair kindly commen,neutral
well i ve started but your bank has frustrated me at e,negative
when i say is useless i m saying it cos i mean it i am experiencing their uselessness at its peak whatever y,negative
shitty bank bruh,negative
bank is fast becoming the bank with the worst customer relations services a visit to any of the branches w,negative
days no more dm day till eternity i wil continue,negative
almost one year and i can t access my corporate account they don t really care,negative
check your dm pls,neutral
holy hanging epstein private banker found suicided by hanging just before thanksgiving millions of dollars in loans,negative
happy independence to our zambian friends and colleagues africasglobalbank ubaat,neutral
this is restored right it s not your fault let you,neutral
the only mails and msgs i keep getting is to exercise patient am tired already firstbank just left me d,negative
t babyy interesting she mentioned opening an account,neutral
to check balance they charge naira,neutral
it s christmas don t miss out on the holiday giveaways happening on our page we are giving out free ubacards pre loaded,neutral
it s not cool that my account gets debited for a service that i didn t get might as well reverse,negative
don t miss out on the mega giveaways happening on our page we are giving out free ubacards pre loaded with cash movie tick,neutral
another transaction was made yesterday evening and another was deducted this is getting too much please chk your dm haba,negative
this is so unfair you guys are not concerned about customer satisfaction just here to post on the hour,negative
please help to support savesunkanmi he is currently on dialysis at clinix health center ilupeju and requires a kidney t,neutral
e pain am,negative
i love uba with passion,positive 
money is being deducted from my account unnecessarily without performing any transaction have emai,negative
twitter please this one is on us peter is losing his sights by the day he needs n to temporarily sustain his sight,neutral
hi pls i did an online payment for my utility bill ikeja disco transaction was successful but pin w,negative
hi tunde we are concerned about your tweet kindly reach out to our help handle accessbank help to get this sorted out,neutral
lots happening with gold bars these days,neutral
access bank have done it again please refund my money i did a transfer to that,negative
do you know can sponsor you for an all expense paid trip to dubai if you start using your verve card for pos,neutral
i nominate abdulwaris ahmed katsina branch to win the magical service award customerserviceweek customerservicew,neutral
follow us for saving tips and tricks,neutral
update after deactivating my card with nothing was done concerning this issue now this guy has cleared the,neutral
happy birthday darl age gracefully,neutral
to the empty pretty buildings and financial district owners banks of ethiopia this is where other banks in afri,neutral
til tcs provides collection agent services to citibank,neutral
hi i once visited your total garden ibadan branch and i noticed that all sections of the bank were properly l,neutral
good day you guys don t want to reverse my money since th june,negative
from the announcement of our arrival to the nine months of preparation the first time our eyes met for ruining your favor,neutral
i ve done that,neutral
since i switched to this bank it s been giving me nothing but joy no stress thumbs up zenith s,positive 
it s been days now and you re still holding my money,negative
remember flybe s collapse has nothing to do with brexit also nothing to do with brexit thomas cook sony flybmi,neutral
happy birthday in advance get retweets on this birthday tweet in hours and we can make an all expe,neutral
i have laid complain to the bank still no remedy accessbank has not been able to li,negative
i need one of these bottles naw you people should give me o,neutral
citi branches will be closed today for thanksgiving but our doors are always open with the citi mobile app,neutral
our first empowerment session at leadcamp is our women in industry our theme is driving change in big indust,neutral
mention and on twitter using the below i nominate medicaid cancer foundation,neutral
jeffrey epstein s private wealth banker who brokered and signed off on untold multiple millions of dollars in controv,neutral
meet waziri bulama bankrupt big man who wants to be apc national secretary owns union bank m,neutral
spiriitual just happened to me now i was debited twice today but i ve contacted now amp t,neutral
okay we are sorry about this transaction please send us a dm on accessbank help lets,neutral
numbers of boko haram that are were captured by team of cjtf led by its leader and commander of of bama lg muazu alhaj,neutral
i did separate transfers from uba to accessbank since saturday,neutral
don t know while its taking eternity to treat dispense error i reported a case of dispense error and m,negative
chek ur balance at times they won t notify u but its already in you account balance,neutral
follow us now for useful banking tips,neutral
goldman sachs jp morgan google ibm microsoft mtv discovery viacom citibank proctor amp gam,neutral
on friday amp hrs i made separate mobileapp transfers until now the money has not been received and,negative
i don t joke with my asun,neutral
sharap everyone saw what happened your branch manager was the one who called in the police to injure the guy i urge al,negative
am lagos nigeria august th i am now yo god continues to bless me gifts to,neutral
dmxchallenge how many branches can you recognise,neutral
can i ask questions pertaining to any issues or complaints here,neutral
we celebrate with our board member mrs onari duke on her birthday today happybirthday from all of us at uba group we appr,neutral
sent you messages via dm long ago without response,negative
so up till now you people do not know the wre about of my k since nov na confirm scammer nna be o,negative
another bbnaija family reunion down at,neutral
firstbank akinwunmi bamidele correction of account number pay me my money and reply me on your facebook,neutral
class act one of the many reasons you keep staying on top,neutral
for more than a week you haven t done anything,negative
hope it will not be like k savin extra which i have been saving since years now and eve,neutral
access bank agip junction is the worst bank ever in the history of banking very poor,negative
uba premieres most anticipated men s club season trailer ubagroup itsredtv abbey coker,neutral
first timer gtbank evidence for and like,neutral
zenith bank use to b one of the best bank in terms of services bt now i dont understand anymore,negative
written instruction like a form or what how do i get it,neutral
the challenge i encountered include delayed services refusal to effect the change of name i applied for,negative
yo guys i sent you a dm,neutral
customerserviceweek tgif keystone medicals on point,neutral
nah lie if u truly high send k to gtbank account,neutral
these ones have frustrated lagosians today can you see how slowly the guys in the zebra prints are walking on the,neutral
i wonder how people will apply for a job and when given the opportunity they will start abusing it stanbic b,negative
wouldn t you want yourself some super sweet iphone s currently available for gb is n gb is n,neutral
i stopped at oando filling station by berger bus stop top up amp the attendant told me i have to pay extra naira,neutral
epstein s private wealth banker didn t kill himself,neutral
what are you talking about someone used my card on fair money or the shit you talking about then,negative
special thanks to our fcmbflexxtern partners digital,neutral
can you help rectify this let s still reflect her cash thanks all,positive 
dear your mess is smelling to high heavens clean it up cc,negative
please reach us via if you have any issues or concerns thank you for your patience,neutral
a lot goes on at the start of a new school term but not having cash for school expenses shouldn t be one of them,neutral
i sent fund to my zenith since i have not seen the fund on my balance,neutral
this is his account details martins ndubueze egbomuche account no please open your dm,neutral
i m a final year student of pharmacy yesterday morning by got a string of alerts from almost all the mone,neutral
a hug a compliment an act of service or giving to the needy can create ripples of kindness as a bank woven into the,neutral
one more day to go you can still win fantastic prizes in the polaris rainbow children s day competition hurry now ht,neutral
it took just a second to debit me for a declined transaction but it s taking working days for resolutio,negative
no response for my complaint,negative
guys i need your help my project water of katampe just got a lifeline we need k retweets for the great people at,neutral
good day brothers and sisters please fatima abdullahi has been a cancer patient for one year now and right now she also has,neutral
ekiti agsmeistraining agsmeispressconference our sincere appreciation to,neutral
it s days to the biggest lagos amateur open golf championship and we can t keep calm this is the th edition and fo,neutral
is ayo fbi behind this account,neutral
you re praying for big bag hope sey your account no be student account,neutral
please my team and i are working on an innovative project to combat ekotraffic kindly help us fill th,neutral
the number of expected guests at s organized africa s largest entrepreneurial fair,neutral
guys i need your help my project water of katampe just got a lifeline we need k retweets for the great people at,neutral
is a company account,neutral
good morning everyone i still need your help with retweets please help god bless you all,neutral
knows the importance of kindness not just in our homes but in our schools with the firstbankspark initiative,neutral
account details fatima abdullah gtbank no amount is little,neutral
i tried to buy airtel airtime via uba mobile app on the nd of june i got the message that it could,neutral
how can i call a bank immediately a fraudulent transaction happened on my account and they say they can t reverse i,negative
remember when we went to new orleans rio at the beginning of the year for a secret project ad excited to announce,neutral
even the said has not entered my account,neutral
spot on,neutral
please and please my refunds,negative
mtschew i don t want their useless money you ll mistakenly spend it and gbam next thing,negative
dear today is my birthday years ago i opened my st account at gtb lasu during my l today that account is m,neutral
hello i made a purchase from the playstore which i cancelled well within the store s refund policy and a refun,neutral
please i forgot my access bank app username and password,neutral
with worldremit online money transfer you can receive your cash transfers at any of our branches,neutral
no it s not up and running anything please because i m cash strapped thanks to you pe,neutral
the future of fashion will be sketched by a new generation of african designers will you be one here is an opportunity to tu,neutral
detty december is about to manifest has promised to give you nothing short of vybes this december de,neutral
hello why is it that i have i am always told whenever i want to transfer money using first mobile that,neutral
i am sure no one has ever visited chappal waddi in taraba state worthy mention obudu mountain resort amp o,neutral
just got off the phone at pm with very rude and impatient people on the line how do you guys h,negative
hello we apologize for the inconvenience caused kindly send us a dm to our resolut,neutral
but working days is too much,negative
to be a mechanical engineer to be a pilot to be a footballer,neutral
have dropped you message already since last night but u don t reply,neutral
lol ehn go and ambassador nah,neutral
bts no citibank bts no allianz em em,neutral
i have done that weeks ago nothing is working and it is worrying,negative
highlights from the ongoing national women basketball league national finals proudly sponsored by zenith bank plc,neutral
everything is poor in this country how could debited me for over a week now on a transaction to,negative
in his opening speech at the grand finale of the icreate skills fest our md abubakar suleiman reaffirmed sterling b,neutral
i wanted to date you but you said you have a boyfriend now you are asking me for money my sister have you ever,neutral
i ve not gotten a retrieval on different debit alerts from my bank one has been long over due since th of may,neutral
i see you guys as thieves these days over was removed as sms charges between september and octobe,neutral
i nominate ubacares,positive 
an account that open did my documentation and till now still have problem withdrawing poor record k,neutral
someone sent money to me i haven t receive d alert what s happening,neutral
so i used my uba card to make a payment at a pos earlier this month twice deducted my money without pay,negative
we need you not to do that,neutral
the visa debit multi currency card is first of its kind to be offered by any financial institution in niger,neutral
dear i did a transfer for someone on the surprisingly till date the person is y,neutral
we will be elated if her bank or individuals can make her dream come true pleas,neutral
i have resent it again i need this issue resolved today unfailingly please,neutral
mbah have you heard that is taking people to dubai yes dubai firstbank is rewarding customers for every pos and we,neutral
holy hanging epstein private banker found suicided by hanging just before thanksgiving millions of dollars in loans,neutral
boss man i hail you big time i just need ur help me with some funds plz i am really boss m,neutral
close my account yeye people,negative
be careful what you share on social media as you may unknowingly reveal personal information that fraudsters could use t,neutral
about last week the shecan nigeria ebonyi state skill acquisition program has been so impactful we continue our emp,neutral
i m paying tax and it s not my duty to clean up waste,neutral
i visited your branch at elf bustop lekki today to pick account opening forms for me and my colleague t,neutral
there is no way for me to dm you need to follow me do i can write you,neutral
have done that severally,neutral
your dm is not open,neutral
your platform was used on the oct to transfer the money was never rec,neutral
kenyan safari abi who no like better thing,neutral
be careful what you share on social media as you may unknowingly reveal personal information that fraudsters could use t,neutral
report in the punch on how much nigerian banks made from maintainance fee charged customers for maintaining their a,neutral
rd panel session on well being in the workplace moderator gibson ateng head health amp benefits p,neutral
i have replied your dm i just hope i am not dealing with automated response here,neutral
in which case loans dedicated to women entrepreneurs have demonstrated higher repayment rates across the globe so this is a,neutral
pls is urgent i mistakingly transfered naira from my access bank account with a c,neutral
matchday digital banking saves you time giving you more time to watch football another incentive highest overall,neutral
y all i m not the most engaging on this app but right now all my energy has been sapped running from to f,neutral
i just received a phone call from this number saying he s from he told me my date of birt,neutral
all i just need from you is a job opportunity i ve always dreamed of working with you although i ve wo,neutral
transaction was successful with nibss id ho,positive 
guys i need your help my project water of katampe just got a lifeline we need k retweets for the great people at,neutral
why borrow another person s account to receive money if you have a phone number that same number without the first zero c,neutral
habba my brother i believe we know how to correct such stupid acts that nonsense needs t,negative
that means you guys are a scam cos i got charged naira for sms notification ch,negative
reporting live from transcorp hilton for day of sterling bank agricultural summit sterlingasa the conversation of c,neutral
i ve not been able to recharge my line or any other line from kindly check it out and do something about it,neutral
i can t use the gtworld mobile app to transfer whereby every transfer done is reversed i cont,neutral
volunteering is a rewarding experience that brings people of all ages together for a good cause get involved with,neutral
dm them on twitter mail them gtconnect com,neutral
i can t use my verve card for web transaction each time i do it says transaction,neutral
today makes it the th day i haven t gotten my money back and you said working days now it s more,negative
since th of june my airtime top up of naira is yet to be reversed transaction done from,negative
leave voters brexit is a monster and it is coming for your job next or your children s and grandchildrens jobs ht,neutral
we are so excited to officially invite you to the th edition of the gtbankfashionweekend november gtcentre plo,neutral
even though isn t here they give me peace of mind banking with them and with that i am content no,positive 
good morning has been holding my refund from an atm withdrawal gone wrong for about weeks now i have w,negative
their mobile app is useless i will advice people never to use the app to buy electricit,negative
it s still count down to s lagos golf amateur tournament they ve been sponsoring this tournament for,neutral
so it s wizkid s birthday today and he ll be around at the ubamarketplace to celebrate it want to be there register,neutral
i dey use gtbank,neutral
guys i need your help my project water of katampe just got a lifeline we need k retweets for the great people at,neutral
jeffrey epstein s private wealth banker who brokered and signed off on untold multiple millions of dollars in controve,neutral
i can t transfer i can t withdraw,neutral
esg and alternative financing in the spotlight seatrade maritime news citibank,neutral
i am trying to open the banking app and it is saying acct number not registered,neutral
foul wema bank win a free kick in the attacking half swung in by olawale but paul reacts quickly to avert the d,neutral
how can a worker be squandering another man s company money this is bad very bad mr oliver agbasoga is a bad p,negative
guys i need your help my project water of katampe just got a lifeline we need k retweets for the great people at,neutral
good day i had dispense error on my account yesterday and till now my money has not been reversed p,negative
hi thank you for contacting us kindly send a direct message to us with details o,neutral
i ve relocated and i want to update it with the new address i ve been doing it but each time i check,neutral
dmxchallenge how many branches can you recognise,neutral
ever wondered what singapore and its technology ecosystem look like here s a snippet into the pitchdriveii founders experi,neutral
you feedback via dm makes no difference,negative
highlights from the ongoing national women basketball league basketball,neutral
hi thank you for contacting us kindly send a direct message to us with details of your e,neutral
best camp ever,positive 
replying at uba group i pick,neutral
how to register,neutral
my debit card was declined at the supermarket and my account was debited has not reve,negative
the option d vehicle leads straight to the sterling atm thanks,neutral
jeffrey epstein s private wealth banker who brokered and signed off on untold multiple millions of dollars in controv,neutral
in other news welcome to gtbank somewhere in lekki earlier today oceaneconomy,neutral
please check your dm,neutral
job well done,positive 
dear pals please help olasunkanmi live again with your donations and prayers he can still fulfill all of his dreams,neutral
dieko is your name in the book of life if not register with gtbank kindly my hustle if this appear o,neutral
junior achievement nigeria jan our partner is giving an open opportunity for students to get a taste of its ent,neutral
what s your current fee and charges on ussd service,neutral
you literally lobbied for aetna and citibank i dont think,neutral
jeffrey epstein s private wealth banker who brokered and signed off on untold multiple millions of dollars in controve,neutral
block these accounts they are currently been usedby a fraudster to defraud liaise with the,neutral
the future of fashion will be sketched by a new generation of african designers will you be one here is an opportunity to tu,neutral
please guys i need your help i need retweets to win this nk giveaway from mazi ibe i need maximum number,neutral
dear please can i know the reason behind the lien of n in my account kindly lift it so that,neutral
going through ups and downs facing obstacles handling failure and all the other difficulties we encounter as ent,negative
shut up have been in your ikota shopping complex no network yet you are asking people to open new acco,negative
dear this is one of the reasons we founded ma we understand the future of jobs and we train niger,neutral
i can t send a dm,neutral
today a class action was filed with the australian federal court accusing some of the world s top investment banks j,neutral
when zenith bank s minimum account balance was and gtbank went for account opening balance their target au,neutral
sometimes i m amazed by how petty i could be i told someone i work as a cleaner in gtbank thread,neutral
lord when i go make this money wey dey my mind gtbank amuda yusuf olatunji,neutral
i don t understand why is publishing the names of delinquent debtors were the loans given without collateral,neutral
good morning firstbank u don t know the year you will fix this issue of failed transaction everytime i,negative
god help me in the name of jesus gtbank djkaywise okiki wiseup,neutral
you have no idea how fast i wanna close account if it takes a year for them to refund i ll breath but i j,negative
some of these responses na bot i no dey rate them at all,negative
i am yet to receive value on a transfer i initiated from my first bank account on nov st fi,negative
super easy way to credit your account from your bank account anywhere any time just dial gtbank users,neutral
i caught the money aspect,neutral
i only have a painful memory with ecobank where they have placed a restriction on my account for j,negative
abuja it s your turn to shineon join us at grand ibro hotel wuse abuja and showcase your exceptional talent accesst,neutral
me when i walk into any gtbank,neutral
i have done that thanks,positive 
dear for over a year now i don t have have atm with you guys but you keep charging me n,negative
no matter the destination you ll always travel light with your ubacards,neutral
alright thanks i just replied,positive 
jeffrey epstein s private wealth banker who brokered and signed off on untold multiple millions of dollars in controve,neutral
a trigger happy officer gruesomely murdered a peace mass bus driver and a youth corper today in front of,negative
don t let anything keep you down tuesdaythoughts zenithbank,neutral
jeffrey epstein s private wealth banker who brokered and signed off on untold multiple millions of dollars in controversi,neutral
thank you for your inquiry the link to the podcast will,neutral
a day in the life at procamp shout out your biggest fan bigbro closertopro,neutral
why can t we enjoy the same grace in festac office,neutral
