text,Score
ever since merged with diamond bank it s been one issue or the other with their network you can nev,negative
been on hold for minutes trying to get to your contact staff i almost know the whole lyrics of the song,negative
the flexxsummerparty is coming up live this friday amp its gonna be fun its featuring your favorite celebr,neutral
me when someone says you need money to open a account heh heh heh zenithaccountwithzeronaira,neutral
michael beirut told me to shut up in an initial meeting i drew the citibank logo on a napkin and walked out paula scher one o,neutral
do everything with leo do everything with united bank for africa,positive 
trdny for trd s latest power lunch katiebrenzel sat down with halstead s diane ramirez citibank s sari rosenbe,neutral
no need for dm my people will contact you,neutral
here is the reference id ccm given to me since rd may you stated that refund will be m,neutral
since has declared today july st as nicecommentday today we are to show kindness with words and appreciate,neutral
hi fcmb customer care can i have the correct swift code for inward remittances for usd please,neutral
to pick their calls and the transaction was just and honestly i don t even have a penny in my,neutral
please for the love of god unfreeze my account it s over weeks now still no p,negative
so this is how you have been stealing my money for sms alert charges for what and times,negative
hello thank you for contacting us kindly send a direct message to us with details o,neutral
please to inform you that my complaint was eventually resolved this afternoon by,positive 
kudos to the department of architecture obafemi awolowo university and o you wanna know why they have made,neutral
please why was my money not reversed i did a transfer to a account there was a network,negative
catch me live at the aspire music fest this saturday see you there cc,neutral
so i m proposing wizkid fans states tour for since can t go around the states we the fa,neutral
happy birthday and i wish you all the best,neutral
my name is obeske akinboye i have a problem with my atm card is not generating otp,negative
malcolm gladwell was right suicide is conttagious,neutral
something big is about to happen looks like we re finally getting back the shows we can all watch this is a huge one,positive 
so i need a new account i already have gtbank and access which bank will you suggest,neutral
if you want your children to be a trust fund baby do this is signing on interested parents now,neutral
pls check your dm again with regards to your reply there,neutral
philippine court refuses to legalise gay marriage saynotoxenophobia shoprite tuesdaythoughts obasanjo,neutral
that guy knows the woman there is no way he wouldn t and he got her atm card details,neutral
olowoayo is giving back to the society by performing for the less privileged children at the bloom party on the th of,neutral
twitter i really need your help i need k to win this nk giveaway from mazi ibe i really need,neutral
today make it days up till now my money is not reverse yet why now,negative
let s go to the beach copalagos is back it s time to soak in the sun sea and soccer give yourself an unforg,neutral
i was debited on my account without payment kindly refund my asap,negative
i tried withdrawing from the atm on thursday a and i was debited without payment and the first bank,negative
it s ubaat giveaway amp we re giving out ubaprepaidcards pre loaded with cash gift bags airtime amp data to win pick a,neutral
you re in big trouble,negative
heritage bank what delays you diane and elozonam is your spoken word plug they will modify the person,neutral
your banking standard,neutral
how is the weekend if you re yet to sign up for edu see the link here registration is,neutral
i did an erroneous transfered via to daniel new style of uba who shared same act no,neutral
piece of advice to everyone any account that has the bulk of your savings shouldn t have a debit card under any circumstance,neutral
firstbank till date i haven t gotten my money back for both transactions what is going on here i,negative
since the days of intercontinental bank i have been using not even a birthday message or anything to c,neutral
i soak you into the divine heavenly yeast rise ohhhhh arise and resemble your owner in jesus name,neutral
government should create jobs but government should create the kinds of jobs that create other jobs cc,neutral
guys i need your help my project water of katampe just got a lifeline we need k retweets for the great people at,neutral
thdec ubabirthday,neutral
justiceforadetutu this is late miss nofisat adetutu ibrahim a staff of she was gruesomely murdered last we,negative
it s ubaat giveaway amp we re giving out ubaprepaidcards pre loaded with cash gift bags airtime amp data to win pick a,neutral
jeffrey epstein s private wealth banker who brokered and signed off on untold multiple millions of dollars in controve,neutral
i ve tried recharging twice via internet banking kept deducting my money but not giving me recharge,negative
you ll sleep there,neutral
with the growing challenges of passing the ielts exam this free ielts masterclass which covers all the aspects req,neutral
institutional banking over years firstbank has built a formidable deposit gathering machine bringing excellen,positive 
is set to take some vendors from nigeria to the world with this ubamarketplace all vendors should make the sm,neutral
we don t want to encourage people writing cvs we want to encourage people to say what they can do and their goal must be de,neutral
bts no citibank bts no allianz em em,neutral
kindly reply my complaints asap pls,negative
the sum of was deducted illegally from my account on the th may account number,negative
guys i need your help my project water of katampe just got a lifeline we need k retweets for the great people at,neutral
it s the weekend if you re planning to go shopping today here are a few tips to help you have the best shopping ex,neutral
thank you so much sam you guys at boa have already been incredibly helpful on this and it s still in,positive 
please can you please explain why i have opened a new account upgraded to vvip for the redtv rave and st,neutral
we are partying like never before at the ubamarketplace with,neutral
thanks you re great,positive 
drinks hair fast food and petrol girls night in with friends as a middle class fine agege geh change go even rem,neutral
hello thank you for contacting fidelity bank apologies for all,neutral
bank charges i know nothing about,negative
when you begin to pay attention to your growth development amp success you have mentally shifted the focus off the classroom,neutral
rd august dear onyebuchi jessy dibiana we sincerely regret the delay in resolving yourcomplain,negative
cbn sanctions four banks for money laundering others for its infractions gtbank plc was asked to pay nm while the unit,neutral
ba ido i can see more than,neutral
pls reply me i have provided all the info you need,neutral
unity bank manager in efcc net over fraud,negative
piece of advice to everyone any account that has the bulk of your savings shouldn t have a debit card under any circumstance,neutral
almighty zenith respond to my complain naa,negative
gtbank i need a touch from the peruzzi,neutral
guys i need your help my project water of katampe just got a lifeline we need k retweets for the great people at,neutral
go to your wifi settings amp select free google station st century a browser window will launch press start en,neutral
speaking at the ongoing agricultural summit sterling bank s ceo said a conversation about food security is,neutral
i doubt it,neutral
what is sensitive ur bank is money is still trap in your bank y,neutral
oo i made the complain olu obasanjo branch in port harcourt,negative
hi kindly help rectify my account has been locked out,neutral
who has k they re not using thank you in advance gtbank my helper might be on your timeline,neutral
do you have little change you can part away with please we need it we will be reaching out to school girls in ab,neutral
this doesn t make what i said untrue you said he checked and real,neutral
the valuejet iau african championship race just received the blessings of the akarigbo of remo land the organizers and s,neutral
account number first bank account name ozah onyebuchi date th may amount,neutral
pls who can help me with cbn twitter handle i want to report,negative
dear you can see what god is doing for others through their banks if you like send me only message on augu,neutral
if i had k i would have fixed a borehole in ruga katampe and give these people clean drinking water how many rts to get,neutral
exactly my point,neutral
i need to deactivate sms alerts on my account thanks,neutral
hey everyone this is fatima umar sani my secondary school friend she has been diagnosed with cancer and needs your hel,neutral
ok thank you it is done,positive 
twitter please this one is on us peter is losing his sights by the day he needs n to temporarily sustain his sight,neutral
i m a final year student of pharmacy yesterday morning by got a string of alerts from almost all the mone,neutral
i know someone currently on s net over something related to this guy s be careful out there good awarene,neutral
is trying to say our personal information is not secure,neutral
i have an issue with my diamond bank account should complaints be directed to you,negative
i cannot even see my history anymore and i m seeing zero balance on dates before today how possible is that a,neutral
dial to stop any debit transaction next time,neutral
starboy wizkid theshutdown redtvrave,neutral
nice,positive 
check your dm asap,neutral
why will banks create risk assets if one fee alone creates n billions,neutral
dear i ve complained severally about large credits to my account at every month end which disappears after a,negative
i once went at area in abuja with my k about yrs ago to open an account i was told,neutral
only me,neutral
what excuses did your parents give you when you asked for the money you were gifted as a child secureyourchildsfuture,neutral
hi please i m user with asebioge bode david i made a transfer via the bank app to a wema ba,neutral
didyouknow bicycle riding directly contributes to out of the sustainable development goals of the united nation,neutral
always remember that life is eazier with eazybanking saturdayvibes,neutral
hey everyone this is fatima umar sani my secondary school friend she has been diagnosed with cancer and needs your hel,neutral
access bank pls i was supposed to receive payment yesterday the sender have been debited but till,negative
even if na n you still need to calm down nor de misbehave like that,neutral
it s ubaat giveaway amp we re giving out ubaprepaidcards pre loaded with cash gift bags airtime amp data to win pick a,neutral
yes oh,neutral
is doing a great job in the north west and north east supporting them financially,neutral
ghana gas forum highlights,neutral
the quality of your customer service is dwindling o,negative
when problems are in abundance solutions require collaboration so don t imagine that you can do it alone,neutral
ready to shop for your organic bath and body treats will be live at the ubamarketplace register now at,neutral
try out the new firstmobile app from first bank,neutral
this my august statement of account please go through if there is any irregularities that is ha,neutral
they offer scholarship opportunities to young and bright students that are limited in financial they,neutral
an error was committed from your bank since on the th of may till today st of may and your ban,negative
your favorite radio program navigatewithidy is live now on fm join for another inter,neutral
i got a call from asking me to call out my atm details for an upgrade amp to confirm when it expires i called o,neutral
we too can t wait for the kick off who gets to be the champions predict the score line at time to win n,neutral
so i have been on this with and for a while now and none of these parties most especi,neutral
hi if you receive revcieved this mail or know someone that did please don t fall for it don t pay this is totally,neutral
so africa s largest entrepreneurial fair ubamarketplace brought together under one roof over people from ov,neutral
beautiful,positive 
i am already on your platform however it limits how much i can transfer daily so i have to go into the branch,neutral
fashion is freedom africasfinest gtbankfashionweekend promotingenterprise,neutral
please reply your dm,neutral
commot from my front abeg everytime you dey apologize you never solve any problem,negative
all right if you are the one on your dp i want to say you look really cool,neutral
it s finally here who are you coming along with to stylebyzenith today,neutral
done ubaat ubamses ubaafricanentrepreneurs,neutral
chill do i school in zenith bank or what because i deffo saw this guy on the poster for party on saturday,neutral
i did a transfer of from my mobile app to sterling bank since morning and was successful but,negative
lots happening with gold bars these days,neutral
your rep igbo efon in collaboration with just emptied my bank account with transactions i d,neutral
am very sorry about this a man that runs this mobile money in my area although his,neutral
they have now forwarded me to irs on the phone why would they do that it is not the irs responsibili,negative
if you re an existing investor in the stanbic ibtc mutual funds then you ve probably heard about the recent changes to ou,neutral
w gdp amp announced an addt m to our initial m x americas commitment the trump admin wgdp amp private se,neutral
have u been robbed,neutral
so sorry about your shop tola please if you feel you re led to donate to her ogundimu omotolani brown gtbank,neutral
please have done that you people keep saying days all the time fidelitycares fidelitybank,neutral
imagine all these fine buildings without any disability access,neutral
more awesome news from s trip wgdp,positive 
kindly check dm its urgent,neutral
liverpool tottenham,neutral
the change in tone,neutral
good day everyone please we need your help to reach girls on the th of may girl donations waoh foundation,neutral
if u people to stress me it s to close the account cos i know by month end u guys will take another naira,neutral
one of the best ways to take advantage of that wonderful asset is to start putting money into a pension account now call,neutral
you wrong doc i worked years as a civil servant monthly pension payments of nk p,neutral
unexpectedly citi has lost a transfer partner in this case it happens to be gatuda indoenisa check out the blog,neutral
dear pls fix the car park in your ganaja junction lokoja kogi state branch it s been like this for year,neutral
dear did i offend you,neutral
gtb atm s upgrade is gtbank,neutral
we are continually committed to empowering youth entrepreneurship throwback to national company of the year ncoy co,neutral
unnecessary deduction from my account imagine waking up to when i was planning to withdraw my last,neutral
guys i need your help my project water of katampe just got a lifeline we need k retweets for the great people at,neutral
please guys this is my mum she is suffering from cancer of the breast she has been placed on chemotherapy but we since,neutral
i have sent my account details to your mail firstcontact com pl,neutral
it s like that in almost all the sectors in the country not just the banks,neutral
please respond to my dm,neutral
justiceforadetutu this is late miss nofisat adetutu ibrahim a staff of she was gruesomely murdered last we,negative
i was debited naira some minutes ago account number is,neutral
since on the of august i made a transfer of to a first bank account and since then the re,negative
let s form a group,neutral
as a part of the process you ll need to provide some details which will help citibank validate your eligibility,neutral
its unfortunate that u didn t respond to my complaint since morning am tired of this your service no,negative
do you know any community in your neighborhood that needs a health or education project then nominate them here,neutral
fidelity account number grace amodu mercy is a scam account please be aware,negative
happy birthday and i wish you all the best,neutral
beware of internet scammers and fraudsters this zenith bank account number is fraudsters peter andre,negative
i want my money back,negative
i ve been refunded in thanks to everyone thanks to everyone who called retweeted posted advised me or supported i,positive 
sha don t forget to send me my good friend upkeep money my account no is in your dm,neutral
educators from winning schools at the rcoy in lagos were awarded scholarships to attend the prestigious,neutral
update thank you for the refund and thank you all for your support really do appreciate gracias,positive 
look at who just became official ambassador none other than wizkid is a child of grace ubamark,neutral
thanks guys,positive 
first bank nigeria take note mazi have spoken,neutral
if you read the message i sent this morning you would see all these details,neutral
what kind of enquiry are you talking about i own both accounts and i did transfer of on several,neutral
big banks know fossil fuels cause climate change but jpmorgan chase bank of america wells fargo and citibank are still,neutral
the lifestyle fair powered by trusts to be a great event come have fun at the eko energy city grounds on no,neutral
since last week that i try to recharge my phone true my first bank account they debited my account and i,neutral
gtbank may almighty allah reward you,positive 
i m paying tax and it s not my duty to clean up waste,neutral
my brother these are hard times check my own tl for my bank story,neutral
i dont even have an account with them but that s what ppl said ab,neutral
this una matter make me lazy o been trying transfer but it keeps bouncing back like what is the problem,negative
just to collect atm card i spent hours in the bank,negative
please the attached tweet i really need a financial help to finalize my researches been on it for years,neutral
why not,neutral
amount is,neutral
dm replied kindly advise further,neutral
i have never won before gtbank burdenofservice,neutral
use some for transport and pay utility bills and but some good stuff that will keep the body alive,neutral
please n is missing from my account since yesterday without any alert and also not reflecting on d app statement of account,negative
hello have been try to apply for loan t amp c on my phone not good was working and i did used the code still same thing,neutral
enjoy up to discounts on all your favourite meals at our ubamarketplace food corner here s a thread of the amaz,neutral
i got the k,neutral
i am calling your attention to a zenith bank account with account number and name ayodeji olaoluwa t,neutral
they dmed me saying they re working on it yet again hopefully lets see what happens,neutral
nawa o i feel frustrated been trying to log in for like an hour now,negative
pls ohh two different transfers and no alert you guys like to give someone high bp,negative
what kind of room has no doors or windows and comment with the answer to win tickets to thelordsoftheribs,neutral
the nigeria basketball federation has announced that registration of players has commenced ahea,neutral
rich people,neutral
we re live at the fintechsummit did you know that first bank is the oldest incorporated entity in nigeria,neutral
thank you,positive 
command teach her how to do,neutral
day camp go get it talin,neutral
jeffrey epstein s private wealth banker who brokered and signed off on untold multiple millions of dollars in controv,neutral
bvi owned bitfinex crypto exchange operator hunts for missing m offshorealert,neutral
christians pls help donate used clothes shoes books cash for food electronic for teaching all alma,neutral
anytime i enter gtbank,neutral
it s been going on for a while actually it s night time you looked into it and stop confusing us,neutral
good morning i carried out some transaction yesterday and i was debited without the other party receivin,negative
hire khafi to do that long heritage speech in the adverts she is worthy look at her bbnajia,neutral
thank you for raising your concerns nero do you mind sharing more details with us via dm using ou,neutral
her name is gift mokwonye she made my day as a satisfied customer sometimes it s good to share some experiences es,positive 
you ve refused to respond to my dm just like the cs has refused to reply my mails i m sure it s never me first,negative
aye bro just imagine being beloved by the city of la after winning ring after ring for the lakers come get you,neutral
i tried to open mobile bank on my phone buh i couldn t do it it asking for referrals id wh,neutral
we have provided feedback on your previous tweet,neutral
i just airtime to my number and i didn t get it and was debited account number,negative
guys i need your help my project water of katampe just got a lifeline we need k retweets for the great people at,neutral
this is day and my acc has not been rectified yet why is it taking so long to return my money just bc,negative
hillz did you register your bvn on any platform scamme,negative
on may th i was debited in a failed pos transaction there has been no refund till now kindly refund the,negative
bros u follow for the promo,neutral
my account number is savings amount transferred is to uba pls treat urgently,neutral
another one bites the dust,neutral
push yourself because no one else is going to push you tgit thursdaythoughts,neutral
i have made several complains but yet i have gotten a response i made a transaction,negative
it s like instant transfer has a different meaning to you people made a tranfer about hours ago a,negative
i did a pos transaction which showed declined and i was debited,negative
ghostdaddi baba i am tired check your dm,neutral
twitter i really need your help i need k to win this nk giveaway from mazi ibe i really need,neutral
which one is timeless account,neutral
dms that you don t respond to so annoying your banking service,negative
please help to beg this people oh i recharge my phone from my account since sunday believe me,negative
don t forget to register here and be a part of the ubamarketplace in abuja don t miss out,neutral
wizkid is looking younger money speaks,neutral
mark bizzelle simple mobile pre paid citibank direct express cell business skype,neutral
we are so excited to officially invite you to the th edition of the gtbankfashionweekend november gtcentre plo,neutral
pls i need ur help to finish my undergraduate study i need for my level second semester examination set fo,neutral
i sent n to the account number it s also a zenith bank account kindly resolve pronto thanks,neutral
to many piercings are the trademark of daring fashionable and adventurous youth to others it is a culture a trad,neutral
please i tried to check and use my account with ussd and the prompt is that i don t have an account,neutral
justiceforadetutu this is late miss nofisat adetutu ibrahim a staff of she was gruesomely murdered last we,negative
the contestants are ready for questions and answers from the judges while we await the jury we love the elegant dre,neutral
hello pharouksanda thank you for contacting us kindly follow us on gtbank help and send us a direct,neutral
please i need my bvn number but my mobile banking isn t working i need it urgently please,negative
i m having issues logging in my card details online facebook precisely,negative
kindly do the needful,neutral
los angeles s music scene is as varied as the city itself this neighborhood focused guide will help you navigate the sounds,neutral
we have shortlisted nominated communities for the stanbicibtcat csi community project we need your help in making th,neutral
i nid otp to do online transactions ilupeju branch dey ask me go mushin vice versa up n down,negative
third from the top,neutral
why is that it is easy to debit me but hard to reverse i was debited last week on different oc,negative
am tired of maybe i should just forget about my debited money since a month now and start using a,negative
hello abuja we are here for the ubamarketplace tag someone who stays in abuja to hangout with us tomorrow afr,neutral
the bank don taya me,negative
i need loan with my uba salary account need ur assistance pls,neutral
i just sent you guys a fresh dm back in response thanks as i await your feedback,neutral
can i also open a corporate account for a business name,neutral
lol gtbank woke me up with a birthday message i thought they would wake me up with a credit alert,neutral
i need to ask you guys a question and it s important how can i send you guys a dm,neutral
saveachildheart yrs old jewoola eliana ibukun need your urgent help for an open heart surgery cost m at sach wo,neutral
do everything with leo do everything with united bank for africa,positive 
here we fixed it someone had to pay for it as well akaranotbeancake sterlingbeancake,neutral
already did that man also uninstalled and installed again,neutral
credit card yields rock hot chase citibank capitalone bankofamerica cards credit,neutral
hbd brother more money in your gtbank account,neutral
bts no citibank bts no allianz em em,neutral
day credit card delinquency leading indicator of charge offs among top sets year high in amp points north,neutral
british financial giant hsbc and american bailout kingpin citibank processed transactions managed money and vouched for,neutral
dear i am pleading that you talk to the beneficiary directly he has consistently deni,neutral
