text,Score
goodmorning i made a transfer of on atm on the app was d,neutral
with just n you too can subscribe to the fgn bonds hurry now and call or send an email to stockbroking,neutral
it s friday time to go make stories for monday cantstopwontstop withyoualltheway,neutral
i sent a dm please check it,neutral
we are calling on food fashion and lifestyle vendors to join us at stylebyzenith lifestyle fair to register simply,neutral
starbiola wow this is really great from they made their staff wear ankara to office to celebrate independence and also,positive 
it s clear that the pain of your customers are jokes to you guys common reversal of a customers hard,negative
i m a final year student of pharmacy yesterday morning by got a string of alerts from almost all the mone,neutral
seriously facing all these people is more or less suicide mission ooo,negative
oh mad mad it is a nibss product or a gtbank product,negative
una well done oo i sent messages to both you and like hrs ago no reply e de,negative
justiceforadetutu justicefortutu are been quiet about the murder of one of their akure staff miss adetutu,negative
i am calling your attention to a zenith bank account with account number and name ayodeji olaoluwa t,neutral
check out s tweet,neutral
i know of two banks that so useless st is and second is the most useless bank in n,negative
recharge was done from my bank account gtbank on th second recharge was done from,neutral
you gonna cry for this mark my word,negative
you guys have frozen my account disabled my ussd service for how long will your investigation go on this is robbery,negative
i was debited of airtime without receiving the card since yesterday via my app till now they haven t rever,negative
thanks for ruining summer for us again mets merchandise and ticket sales never have ca,negative
good morning what s the problem with your mobile app i m finding it difficult to make transfers please fix it thanks,negative
dear this dude is one of my followers if you give him a job i promise you i will reactivate my account,neutral
why directing me to a handle you know you can t access them via dm,neutral
you are all over the place get the simple things done first you can easily become the best bank not just the big,negative
worried about summer don t worry got you firstbank naira mastercard has an ehnaced spend lim,positive 
you dey show the game for any of your branches,neutral
with a will your family can look forward to a secure future call or email sitlagency com for mor,neutral
already did days ago please check,neutral
i had dispense errors for debit since december with my account i tried a,negative
i just performed another transaction just now that wasnt sucessful and was debited with the same reply as,negative
need my account information ,neutral
jeffrey epstein s private wealth banker who brokered and signed off on untold multiple millions of dollars in controve,neutral
what is happening to my account i have been debited severally since yesterday wi,neutral
dmxchallenge how many branches can you recognise,neutral
jeffrey epstein s private wealth banker who brokered and signed off on untold multiple millions of dollars in controve,neutral
spot our ad on any led boards take a picture tag us with the hashtag and you could win exciting prices,neutral
sec urges investors of defunct skye bank to claim their dividends via marketforces,neutral
help omashola create more timeless experiences in the bbnaija pepper dem house voting closes at wat so hurry and vote,neutral
to be fair hoarse is a bro through and through in real life he s a straight white consultant to places like exxon citiban,neutral
just imagine kinging in a place that s not even your country nor city whattt well with any of cards yo,neutral
good day kindly see to may account showing my account number is,neutral
w gdp amp announced an addt m to our initial m x americas commitment the trump admin wgdp amp private se,neutral
i have k followers if only k people donate naira each babatunde will be free of heart disease savebabatunde,neutral
do you know the network is processing over customer transactions daily in over local government area,neutral
omo make I sent aza,neutral
kindly check your dm,neutral
team in all,neutral
stanbic ibtc money market is anytime bank ac,neutral
i am the great baba of ijebu land call baba on this simple and don t keep your problems to,neutral
hello fams dan allah and follow plx location kano state dan allah,neutral
okay since this is trending here s myhoarsewispererstory hoarse wisperer is a marketing guy who s worked with exxon,neutral
please is there a way i can talk to the contact centre without calling i m currentl,neutral
our ekiti of now amp ekitivaluesrestoration csr corporatesocialresponsibility done in a transparent approach,neutral
i ve kept saying this but you ll want to believe what you want it s delayed debits since the first time i funded,negative
please what has been going on with you guys lately honestly this whole constant bad network thing is actually getti,negative
are you open on saturdays in lagos why does transfers to credits cards after pm become useable on,neutral
seriously you guys are insensitive of my plight i should kindly follow you guys on twitt,negative
i can t login mobile app it s says i m not registered and it won t let me register i was using it,neutral
please i sent u a already,neutral
here s an opportunity every business owner can t access with ease somewhere other than in fcmbquickloans got you,neutral
pls check your dm you have promised me that reversal will be done on or b th may imagine since friday th,negative
how i m rushing to leave the bed and head to the bank when i heard is rewarding customers for reactivating,positive 
done complaining go work on your system the inefficiency is too much you re officially the worst bank of the year,negative
happy sunday everyone,neutral
because the giver s credited and the receiver debited,neutral
friends please join ladylake music and the envision indie coalition as we donate time and talent supporting nokid,neutral
days to go to one of the best african fashion experiences in the continent the fashion weekend day,neutral
dear why do u take charges at midnight stamp duty charges too mid night take the money day time ban,negative
how can l advance when all my funds in the bank has been wired away my rating for is zero for pr,neutral
the answer is actually zero what evil don t last solved was balderdash,neutral
all these one na grammar update your system and resolve issues faster,negative
every single year goes all out to beautify eko hotel roundabout and the whole of ajose adeogun street because,neutral
we won t take their fraud and ineptitude lightly anymore next week,negative
when zenith bank s minimum account balance was and gtbank went for account opening balance their target au,neutral
lol zenith is lowkey the boss o agba awo ni bank yen mehn,positive 
aside from language batman is too serious for odunlade but he s the perfect match for joker tho,neutral
at we believe we can build a world filled with kindness all it takes is for each of us to be a li,positive 
you said maintenance has been completed but yet i keep getting this error message,negative
holy hanging epstein private banker found suicided by hanging just before thanksgiving millions of dollars in loans,negative
and diamond bank were not ready for the operational demands of that merger acquisition my banking e,negative
is it the that is charging ussd or who,neutral
answer this question with a word without saying yes yeah yep or yup do you want to win n million when we hit,neutral
there are many things to be won nigeria s biggest sporting event this year is just a few days away the race will flag,neutral
in other news welcome to gtbank somewhere in lekki earlier today oceaneconomy,neutral
attend to the above tweet,neutral
best bank in the world,positive 
follow us now for useful banking tips,neutral
wow really,positive 
imagine all these fine buildings without any disability access,negative
please respond to my dm you asked i replied o pendingreversal,negative
when the app hardly works you ve failed i enjoyed diamond bank until you took over can t wait,negative
the headquarter of is engulfed in fire at victoriaisland lagos visit postnige,neutral
one bag to rule them all,neutral
please i can t waste my imagination,negative
please i want to report a case to you the atm of swallowed my card bank staff say i must go to my bank t,negative
most definitely they charge for almost anything i literally withdrew all my money to avoid unnecessar,negative
let me see if can borrow me small change,neutral
and bytheway i don t understand the ussd service anymore i am not able to check my balance on it,negative
ft futa s goalkeeper with the man,neutral
i have access to the mail and you are not replying your dm,neutral
please what is nft revenue got a credit alert from you with that description i am not expecti,neutral
you ve been frustrating me since last night from debiting n from my mom s account to,negative
press pause on the bbnaija remote nm enterpreneur grant is up for grabs enterpreneur will walk away this wedne,neutral
can you guess what it is wednesdayteaser humpday wackywednesday,neutral
no one is born hating another person because of skin color or race or background or religion people learn to hate,neutral
i got this from and i replied thank you o,positive 
i complained to about both of failed deposit to my betnaija account and another,negative
i m a student brother na to chop dey do me any amount will do god bless you richly gtbank,positive 
please reverse my money o,negative
this your quick credit should be available for savings a c holders with good cash flow also or,neutral
who remembers what this radio is called we cannot forget days when getting this radio felt like an achievement tb,neutral
buy airtime with and get bonus airtime it s that easy offer valid for minutes from am and pm,neutral
return my money return my money return my mo,negative
no body wants to scam her thats where am working that la,neutral
jeffrey epstein s private wealth banker who brokered and signed off on untold multiple millions of dollars in controv,neutral
congrats sire,neutral
it s ubaat giveaway amp we re giving out ubaprepaidcards pre loaded with cash gift bags airtime amp data to win pick a,neutral
for nigeria like for cameroon leggo afcon africasglobalbank iwobi bahoken,neutral
same here it s lamentable how gtb treat their customers i forwarded a complaint on dispense error on four differe,negative
dear kindly address this issue cc,neutral
till now no response and you keep telling me to bear with you very poor response if you would a,negative
do you have idle money just lying in your savings account open a sterling fixed deposit account and start earning int,neutral
the beneficiary has contacted wema bank with the digit session id and has been referred back to me fbn,neutral
still shopping at then you are shopping wrong are you still banking with don t you know you ar,neutral
thanks,positive 
will check,neutral
communities play a strong advocacy role in ensuring that aids is defeated let s continue to raise the bar to defeat aids,neutral
thanks for not emulating,positive 
nipost piloting the digital revolution in nipost,neutral
i tried to recharge my line using on the my account was debited for but i didn,negative
can someone please attend to me,negative
giveaway alert airtime for random people follow this link and vote abdulwaris ahmed now kindly drop a pro,neutral
can you people please reverse my naira failed airtime transaction its been nearly a month,negative
do everything with leo do everything with united bank for africa,positive 
my friend has since replied your nail and sent his account number and name in a mail but you are yet to re,negative
please reply me,neutral
the weekend is here and you definitely do not want to miss out on this a minimum recharge of n between pm pm dai,neutral
reply asap lemme send u guys my account number please,neutral
i ve been refunded in thanks to everyone thanks to everyone who called retweeted posted advised me or supported i,positive 
well is a product of that gives you intere,neutral
could you kindly call your ajah branch we ve been on queue for the past hour and a teller herr,negative
please kindly check your dm,neutral
remember this has nothing to do with brexit also nothing to do with brexit sony dyson flybmi jaguar land rover,neutral
okay send me the details,neutral
you people have been doing this thing to me for a while now i just choose to overlook it i ll be debited for t,negative
what s wrong with uba mobile banking platform i can t perform any transactions and u deducted my money in the process,negative
please what kind of trouble is this i made a transfer since midnight yesterday and the person i tr,negative
good day i tried using my mastercard to fund my forex broker i got debited but the money didn t fund o,negative
w gdp amp announced an addt m to our initial m x americas commitment the trump admin wgdp amp private se,neutral
hi biggie biggie kindly send your account number to our help handle accessbank help so we can further ass,neutral
highest paying nigerian companies schlumberger cbn greenville tgi vetiva citi bank inview nigeria nestle african health,neutral
i can t transfer via the app kindly assist please,neutral
desserts too must be crack,neutral
please see your dm do you people want to kill me,negative
firstbank from till date my money has not yet return firstbank what is happening you pple ask,negative
can you answer this without using a calculator share your answer in the comment section youfirst,neutral
congratulations ivanka trump well done,neutral
pls i transferred money to someone was deducted but the person did not get it kindly help,negative
retrofit that citibank building by lewisham precinct slap a cpo on it no ones been using it for years and years you,neutral
your ubaprepaidcards keep your spending in check best part is it s not linked to any account simply call it your,neutral
drumroll please congratulations to the lucky winners of our tradday spot and win competition please dm,neutral
i ve has so many issues resolved on my account without having to step in the bank thanks to this bank for now lol,positive 
wemabank still hasn t returned my money,negative
my cash is needed where is my money i need this cash and seriously i need it,negative
steps make a video of u replicating dx video follow amp tag amp,neutral
with md mr and doyint,neutral
but the first complaint is yet to be resolved till date,negative
i jst dnt knw y ur customer servix is extremely poor i m currently fcmbabakroaduyoakwaibom the populatio,negative
why is your bank delaying credit transaction since yesterday,negative
you ve not replied my dm since morning i don t think you can fix his,negative
hello please i need to confirm the status of the transfer made with this reference number,neutral
i ve not gotten my money o release my money,negative
first bank open your dm i have a complain,negative
can you pls respond to my request i asked for a request since last days and nothing has been done about it,negative
i fall victim paid to him,negative
i warm up to only money,neutral
hi thank you for contacting us kindly send a direct message to us with details of your en,neutral
want to get into music watch now for advice from me and other women in the industry for making this vid h,neutral
hi we are sorry about the experience kindly send a dm providing your account number,neutral
nice one lots need to be educated on this,positive 
you haven t snet anything you people are so unprofessional and unpleasant gosh,negative
so i tried to recharge from my mobile app and it clearly gave me an error message th,negative
still shopping at then you are shopping wrong are you still banking with don t you know you ar,neutral
twin doves concepts presents kody and the kids children s day edition date may th ace,neutral
tania is available in all sizes visit the website to purchase cegar gym wear detox bottles and,neutral
don t miss out on the action as david tlade heats up the runway with their designs at the style by,neutral
justiceforadetutu this is late miss nofisat adetutu ibrahim a staff of she was gruesomely murdered last we,negative
are you going to reply me or do i ve to cuss at you first,negative
institutional banking over years firstbank has built a formidable deposit gathering machine bringing excellen,positive 
i need your help please,neutral
make an enquiry for agent fastmoni work,neutral
gtbank is moving mad,positive 
epstein strikes again another one kills themself one of his bankers,negative
please kindly reconnect and restore viewing for sc paid for access bouquet yesterda,neutral
we are hiring we re looking for individuals who re problem solvers customer centric amp efficient to join our team,neutral
yes you can open an account from your phone bvn has the info they would n,neutral
remember flybe s collapse has nothing to do with brexit also nothing to do with brexit thomas cook sony flybmi,neutral
thank you so much dear but unfortunately we are sorry to disap,neutral
don t be there n watch good opportunities pass you by nau hurry and reactivate your first bank verve card and stand a,neutral
close your eyes and imagine africasfinest models decked in breathtaking designs sketched by you with the crowd cheering you o,neutral
hello please check your dm for an urgent issue,neutral
we have just concluded an extensive systems upgrade of our customer base of over million a feat by even global stan,neutral
i am calling your attention to a zenith bank account with account number and name ayodeji olaoluwa t,neutral
the game zone is fully packed and the competition is fierce cash prizes of up n to be won ubamarketplace,neutral
jeffrey epstein s private wealth banker who brokered and signed off on untold multiple millions of dollars in controv,neutral
dear please tell to return my money it been weeks now and anytime i complain i kee,negative
dear this will be the second time you people will remove money from my account without any transact,negative
bia so after the dm i sent you have kept quiet i don t blame you shaa let me reach any branch today god knows i will g,negative
no and neither has trump you dumb fuck he couldn t make his payments he tried,neutral
let s throw it back shall we throwback to the sara by wema seminar running a profitable business where women came to,neutral
don t sleep on this one oooo people will win k eachfrom campus tech fest how using campustechfe,neutral
i made some payment and my account is debited and yet it didn t reflect in the marchant account why,negative
me way think say ppl for done forget d challenge and move on naso i dey c tweets dey go up and down but m,neutral
i thought i was getting this obama when i voted for hope amp change instead i got citibank amp reaganism,neutral
you can rest assured see grammar,neutral
managing director ecobank nigeria patrick akinwuntan and other staff of ecobank nigeria recently paid a courtesy,neutral
very very frustrating,negative
please anybody can help too oh gtbank,neutral
cardmembers we have a treat for you this summer use your citi card for access to all in reserved tix for select shows,neutral
what a place to be,neutral
thanks i transfered n from accoubt to an on the rd of this month it was,positive 
tope alabi will collect extra sheet,neutral
what band could the see themselves collaborating with next on a song they dished on this and so,neutral
lool they re using our money to shine,negative
gtbank sending an e mail saying we are all about the magic if my money miss,neutral
please help me to do something about it asp because i need to use the money urgently thanks,neutral
i also want to close that account first thing on thursday morning if i don t get back my mo,negative
please i want to see the result of all hands being on deck i want my money today,negative
africanlady gtbank hope u see me here sir,neutral
sure mr met and social media team can handle that,neutral
dear the person with name jones uwakwe acc is involved in fraud activity i will appreciate it if its,negative
i have legacy diamond bank accounts corporate savings current and joint i am glad the,neutral
exactly used the whole month reply my dm abeg,negative
please do bank with more progressive banks,negative
you lied,negative
good afternoon please see ur dm,neutral
w gdp amp announced an addt m to our initial m x americas commitment the trump admin wgdp amp private se,neutral
guys i need your help my project water of katampe just got a lifeline we need k retweets for the great people at,neutral
access bank is like you people doesn t want to be banking with you transferred money from my acce,negative
thank you,positive 
haven t you heard of snap and win challenge simple task just spot a first bank staff wearing the,neutral
do you know that is giving out cash to people attending the campus tech fest event simply visit,neutral
thanks much sir am honoured,positive 
kindly check your dm,neutral
world premiere new hit single designer artist joquarter produced by jo q mixed amp mastered by g,neutral
gtbank silence,neutral
super annoying,negative
set your alarm clocks buy airtime with using from at pm tonight and get bonus airti,neutral
sure,positive 
liverpool tottenham,neutral
i ve been refunded in thanks to everyone thanks to everyone who called retweeted posted advised me or supported i,positive 
done thanks ,positive 
pictures form gtbank fashion wknd coming soon,neutral
gtbank need to do better sterling bank would have called if my transfer went twice or not even successfully after,negative
you re a beast just as your display name says,negative
seankessie still on my mobile app drop your account number only gtbank users i ll randomly credit persons with k each,neutral
day card delinquency among top issuers on upward trajectory rising bps from q and expected to seasonal,neutral
the countdown is on just one more day until jonasbrotherstoday,neutral
wow so wants to usher you into the detty december with the lifestyle fair fashion music games etc wi,neutral
mauritiuzz oh sorry but i didn t get any messages at my dm,neutral
i see some people are having issues with their account opening please call busola tell her ne,neutral
for your information i contacted the service provider to confirmed the value on th and they sa,neutral
it s national read a book day over the years nigerian authors such as chinua achebe chimamanda adiche and several,neutral
this man hole is right in front of these two banks and at alagomeji area of yaba i approached the secur,neutral
dear this is one of the reasons we founded ma we understand the future of jobs and we train niger,neutral
i was privileged to speak about acing job interviews at s annual edu event last week i am thankful to,positive 
sir uba team in new york sir please see how new york is crowded yet light just now,neutral
pls advise i did a transfer from another bank to my gtb acct the acct was debited but is yet to reflect in my gtb acct,negative
as we conclude the holy month of ramadan may you grow in faith and spirit eidmubarak,neutral
in need of quick cash for next weekend not a problem at all got you covered you can access up to n loan,neutral
could not be more thrilled to have the illustrious drop a verse at the citi viewing deck today at,neutral
aud usd likely to remain in the range citibank via fxstreet forex fx,neutral
cheers to the weekend take sometime to relax today and drink lots of water ubamarketplace ubaat africasglobalbank h,neutral
am on my way myafconexperience,neutral
are you going to gov ball in new york next weekend governor s ball,neutral
this one gtbank is sending me msg anyhow is like big money is coming o,neutral
good afternoon i made a transfer of n to a gt bank account now the response i got was the beneficiary bank is not av,negative
it s day of the ubamarketplace entrepreneurial fair and there s still so much to buy eat see and do the fair e,neutral
ubamarketplace colours on ice,neutral
never mind it has been resolved thanks,positive 
has just signed an endorsement deal to become a brand ambassador for ubamarketplace eventkettl,neutral
do you have spare funds we have investment options talk to our investment gurus on or send an email to asset,neutral
i was considering opening an account before,negative
this is the transaction details i made the transferred to zenith bank time am,neutral
to be fair hoarse is a bro through and through in real life he s a straight white consultant to places like exxon citiban,neutral
valkiing where are my fashionistas is giving you an opportunity to tell your story on a grand stage you don t wanna sle,neutral
would you tell me how to close my citibank careers account after login i see no account removal option no contact us either,neutral
hear this and thank me later,neutral
institutional banking over years firstbank has built a formidable deposit gathering machine bringing excellen,neutral
we will have a surprise guest at the marketplace can you guess who it will be amp comment your answer with ubamarke,neutral
like i said thank you okay bye,neutral
transfered cash to someone twice on friday but only one dropped but you deducted twice pls send back my cash,neutral
auditions are on in lagos do you think you have what it takes to be the star of the show meet us tomorrow at ltv,neutral
i know someone currently on s net over something related to this guy s be careful out there good awarene,neutral
waaaaiiiitttt what ladies and gentlemen shall we,neutral
